{
  "schema_version": "2.0.0",
  "updated_at": "2026-09-27T15:01:36Z",
  "editors": [
    "seed-script",
    "seed-reset",
    "auto-extractor"
  ],
  "topics": {
    "aborto": {
      "topic_id": "aborto",
      "topic_label_pt": "Aborto",
      "topic_label_en": "Abortion",
      "candidates": {
        "lula": {
          "position_type": "inferred",
          "stance": "neutral",
          "summary_pt": "Embora o debate interno exista, a posição oficial evita a liberalização ampla do aborto, defendendo a descriminalização apenas em casos específicos.",
          "summary_en": "Although internal debate exists, the official position avoids broad liberalization of abortion, advocating for decriminalization only in specific cases.",
          "key_actions": [],
          "sources": [
            {
              "type": "news_report",
              "url": "https://pt.wikipedia.org/wiki/Luiz_Inácio_Lula_da_Silva",
              "description_pt": "Embora o debate interno exista, a posição oficial evita a liberalização ampla do aborto, defendendo a descriminalização apenas em casos específicos.",
              "description_en": null,
              "date": "2026-03-25",
              "article_id": null
            },
            {
              "type": "party_platform",
              "url": null,
              "description_pt": "Embora o debate interno exista, a posição oficial evita a liberalização ampla do aborto, defendendo a descriminalização apenas em casos específicos.",
              "description_en": null,
              "date": "2026-03-25",
              "article_id": null
            }
          ],
          "last_updated": "2026-03-25",
          "editor_notes": "SEEDED:party_profile,wikipedia - requires human review"
        },
        "flavio-bolsonaro": {
          "position_type": "inferred",
          "stance": "against",
          "summary_pt": "Flávio Bolsonaro é filiado ao Partido Liberal (PL), cujo posicionamento oficial é contrário ao aborto em qualquer circunstância, defendendo a proteção da vida desde a concepção.",
          "summary_en": "Flávio Bolsonaro is affiliated with the Liberal Party (PL), whose official position is opposition to abortion under any circumstances, defending the protection of life from conception.",
          "key_actions": [],
          "sources": [],
          "last_updated": "2026-09-27",
          "editor_notes": "AUTO-EXTRACTED: requires human review before publishing."
        },
        "caiado": {
          "position_type": "inferred",
          "stance": "against",
          "summary_pt": "Caiado, do União Brasil, adota posicionamento contrário ao aborto, alinhado ao discurso tradicionalista do partido sobre proteção à vida desde a concepção.",
          "summary_en": "Caiado, from União Brasil, holds an anti-abortion stance, aligned with the party's traditional pro-life position since conception.",
          "key_actions": [
            "Voto em projetos de proteção à vida e restrição ao aborto",
            "Afastamento de parlamentares que apoiam a ampliação do acesso ao aborto"
          ],
          "sources": [],
          "last_updated": "2026-09-27",
          "editor_notes": "AUTO-EXTRACTED: requires human review before publishing."
        },
        "zema": {
          "position_type": "inferred",
          "stance": "against",
          "summary_pt": "Romeu Zema é filiado ao Partido Novo, que possui uma posição conservadora predominante, o que sugere uma postura contrária ao aborto.",
          "summary_en": "Romeu Zema is affiliated with the Partido Novo, which has a predominantly conservative stance, suggesting an opposing position on abortion.",
          "key_actions": [],
          "sources": [
            {
              "type": "news_report",
              "url": "https://pt.wikipedia.org/wiki/Romeu_Zema",
              "description_pt": "Romeu Zema é filiado ao Partido Novo, que possui uma posição conservadora predominante, o que sugere uma postura contrária ao aborto.",
              "description_en": null,
              "date": "2026-09-27",
              "article_id": null
            },
            {
              "type": "party_platform",
              "url": null,
              "description_pt": "Romeu Zema é filiado ao Partido Novo, que possui uma posição conservadora predominante, o que sugere uma postura contrária ao aborto.",
              "description_en": null,
              "date": "2026-09-27",
              "article_id": null
            }
          ],
          "last_updated": "2026-09-27",
          "editor_notes": "SEEDED:party_profile,wikipedia - requires human review"
        },
        "renan-santos": {
          "position_type": "inferred",
          "stance": "against",
          "summary_pt": "Renan Santos, como membro do MBL, é contrário ao aborto, seguindo a posição conservadora do movimento.",
          "summary_en": "As a member of MBL, Renan Santos opposes abortion, in line with the movement's conservative stance.",
          "key_actions": [],
          "sources": [
            {
              "type": "party_platform",
              "url": null,
              "description_pt": "Renan Santos, como membro do MBL, é contrário ao aborto, seguindo a posição conservadora do movimento.",
              "description_en": null,
              "date": "2026-03-25",
              "article_id": null
            }
          ],
          "last_updated": "2026-03-25",
          "editor_notes": "SEEDED:party_profile - requires human review"
        },
        "augusto-cury": {
          "position_type": "inferred",
          "stance": "against",
          "summary_pt": "Augusto Cury é contra a liberalização ampla do aborto, posicionamento conservador alinhado ao partido Avante.",
          "summary_en": "Augusto Cury is against the broad liberalization of abortion, a conservative stance aligned with the Avante party.",
          "key_actions": [],
          "sources": [],
          "last_updated": "2026-09-27",
          "editor_notes": "AUTO-EXTRACTED: requires human review before publishing."
        },
        "edmilson-costa": {
          "position_type": "inferred",
          "stance": "favor",
          "summary_pt": "Como Secretário-Geral do PCB, Edmilson Costa está associado à posição do partido favorável à descriminalização e ao direito ao aborto legal e gratuito.",
          "summary_en": "As PCB General Secretary, Edmilson Costa is associated with the party's position favoring decriminalization and the right to legal and free abortion.",
          "key_actions": [],
          "sources": [
            {
              "type": "news_report",
              "url": "https://pt.wikipedia.org/wiki/Edmilson_Costa",
              "description_pt": "Como Secretário-Geral do PCB, Edmilson Costa está associado à posição do partido favorável à descriminalização e ao direito ao aborto legal e gratuito.",
              "description_en": null,
              "date": "2026-09-27",
              "article_id": null
            },
            {
              "type": "party_platform",
              "url": null,
              "description_pt": "Como Secretário-Geral do PCB, Edmilson Costa está associado à posição do partido favorável à descriminalização e ao direito ao aborto legal e gratuito.",
              "description_en": null,
              "date": "2026-09-27",
              "article_id": null
            }
          ],
          "last_updated": "2026-09-27",
          "editor_notes": "SEEDED:party_profile,wikipedia - requires human review"
        },
        "hertz-dias": {
          "position_type": "confirmed",
          "stance": "favor",
          "summary_pt": "Hertz Dias é favorável à descriminalização do aborto, conforme declarado em seu programa político e documentos oficiais do PSTU.",
          "summary_en": "Hertz Dias supports the decriminalization of abortion, as stated in his political platform and official PSTU documents.",
          "key_actions": [
            "Favorou a descriminalização do aborto no programa de governo.",
            "Apoou a legalização do aborto durante campanha eleitoral."
          ],
          "sources": [
            {
              "type": "news_report",
              "url": "https://pt.wikipedia.org/wiki/Hertz_Dias",
              "description_pt": "Hertz Dias é favorável à descriminalização do aborto, conforme declarado em seu programa político e documentos oficiais do PSTU.",
              "description_en": null,
              "date": "2026-09-27",
              "article_id": null
            },
            {
              "type": "party_platform",
              "url": null,
              "description_pt": "Hertz Dias é favorável à descriminalização do aborto, conforme declarado em seu programa político e documentos oficiais do PSTU.",
              "description_en": null,
              "date": "2026-09-27",
              "article_id": null
            }
          ],
          "last_updated": "2026-09-27",
          "editor_notes": "SEEDED:party_profile,wikipedia - requires human review"
        },
        "samara-martins": {
          "position_type": "inferred",
          "stance": "favor",
          "summary_pt": "Como vice-presidente nacional do partido Unidade Popular (UP), Samara Martins filia-se a uma legenda que tem como posicionamento oficial a defesa da descriminalização e legalização do aborto.",
          "summary_en": "As national vice-president of the Popular Unity (UP) party, Samara Martins is affiliated with a party whose official platform supports the decriminalization and legalization of abortion.",
          "key_actions": [
            "Vice-presidência nacional do partido Unidade Popular (UP)"
          ],
          "sources": [],
          "last_updated": "2026-09-27",
          "editor_notes": "AUTO-EXTRACTED: requires human review before publishing."
        },
        "wilson-grassi": {
          "position_type": "inferred",
          "stance": "against",